{
  "project": {
    "title_ko": "검진 다음 날부터",
    "tagline": "검진 다음 날, 터질 게 보인다",
    "core_premise": "터질 프로젝트를 먼저 읽고, 숨겨진 숫자를 파고, 결재선을 거슬러 직보한다. 건강검진 다음 날부터 조직의 의사결정 구조가 도식처럼 읽히기 시작한 중견 유통사 경영기획팀 3년차 한시혁이, 결재선 최적화에서 시작해 프로젝트 오너십, 예산 편성, 인사 라인을 순서대로 장악하며 3년간 이름 한 번 불린 적 없던 투명인간에서 본사 전체가 거치는 관문 노드로 올라가는 이야기. 능력의 정체는 끝까지 애매하게 두고, 독자도 중반까지 확신하지 못한다.",
    "format": "현대 한국 중견 유통사 조직장악물 (남성향/no-romance/현실밀착형 능력물)",
    "logline": "중견 유통사의 전사 최대 투자안을 멈춘 건 3년차 말단 사원이었다. 건강검진 다음 날부터 어떤 프로젝트가 터질지, 누가 숫자를 숨기는지, 결재가 어느 임원 선에서 막히는지가 먼저 읽히기 시작한다. '왜 저 새끼가 다 아는 거지.'",
    "start_year": 2025,
    "end_year": 2027
  },
  "setting": {
    "group_background": "무대는 매출 8천억대 중견 유통사, 코스닥 상장사다. 본사·물류센터 3곳·전국 직영/가맹 점포를 거느리며 SCM, MD, 영업이 한 회사 안에서 세게 엮여 있다. 겉은 안정적이지만 MD사업부의 숨겨진 적자, 물류센터 비효율, 관성화된 결재선과 외주 컨설팅 의존 구조가 내부를 갉아먹고 있다. 외부 감사 시즌과 분기 예산 편성 일정이 다가올 때마다 숨긴 숫자가 흔들린다.",
    "execution_doctrine": "읽히는 것을 행동으로 전환한다. 결재 경로를 최적화하고, 터질 프로젝트를 먼저 짚고, 짚은 문제를 직접 해결해서 공을 가져간다. 무기는 항상 정보 우위와 타이밍이다.",
    "starter_company": {
      "name": "중견 유통사 경영기획팀",
      "state": "사수 퇴사 후 혼자 남은 팀 막내, 잡무 담당, 인사평가 B0",
      "assets": [
        "조직 역학 조감 감각 (검진 후 발현)",
        "3년간 쌓인 실무 지식 (활용되지 못한 채 묻힌 상태)",
        "성실한 작업 습관"
      ],
      "liabilities": [
        "존재감 제로 (이름이 한 번도 불린 적 없음)",
        "팀장 오세진의 공 가로채기 구조",
        "인사평가 B0 (중하)",
        "사내 네트워크 전무"
      ]
    }
  },
  "protagonist": {
    "name": "한시혁",
    "age_at_start": 29,
    "status": "중견 유통사 경영기획팀 3년차 사원",
    "public_image": "조용하고 성실하지만 눈에 안 띄는 사람. 사수 퇴사 후 혼자 남은 팀 막내.",
    "true_strength": "조직 역학 조감 감각 — 회의실에 들어가면 결재 병목, 숨은 리스크, 프로젝트 붕괴 지점, 사람 배치의 병목이 도식처럼 읽힌다. 본인은 머리가 맑아진 것 정도로만 인식.",
    "true_weakness": "감정적/비합리적 의사결정 앞에서 읽기가 흔들린다. 또한 감각에 의존하기 시작하면서 감각이 안 통하는 상황에서 판단력이 오히려 떨어질 수 있다.",
    "initial_goal": "투명인간에서 벗어나 이름이 불리는 사람이 된다.",
    "mid_goal": "프로젝트 오너십과 예산 발언권을 확보해 조직 내 실권자가 된다.",
    "final_goal": "중견 유통사 본사 전체가 자신의 관문과 규칙을 거치지 않고는 움직이기 어려운 상태를 만들고, 결재선·예산 코드·프로젝트 오너십·인사 라인을 본인 손으로 재배치할 수 있는 위치에 오른다."
  },
  "phase0_design": {
    "arcs": [
      {
        "arc_id": "ARC-01",
        "title": "검진 다음 날",
        "block_range": "1-10",
        "time_window": "2025년 3월~2025년 5월",
        "capital_target": "Lv1 자료작성권 -> Lv4 상신권",
        "front_sectors": [
          "경영기획팀",
          "SCM/물류"
        ],
        "support_sectors": [
          "MD사업부"
        ],
        "main_opponents": [
          "오세진",
          "장현태"
        ],
        "new_npcs": [
          "한시혁",
          "오세진",
          "장현태",
          "박전무",
          "김대표"
        ],
        "emotion_curve": "굴욕 -> 각성 -> 첫 사이다 -> 간판 폭발 -> 체감형 보상",
        "quiet_blocks": [
          6
        ],
        "defeat_blocks": [
          4
        ],
        "entry_function": "3년간 이름 한 번 불린 적 없던 말단 사원이 건강검진 다음 날부터 터질 프로젝트를 먼저 읽고, 막힌 결재선을 거슬러 첫 직보로 전사 최대 투자안을 멈춘다. 굴욕→각성→간판 폭발의 속도로 직행하는 오프닝 아크.",
        "exit_function": "물류 통합안 저지와 보상 4종을 통해 시혁이 TF 실무 간사이자 전무 직보 라인으로 올라서며, 다음 아크의 전장이 경영기획팀 구석에서 TF룸 전체로 확장된다.",
        "block_slots": [
          {
            "block": 1,
            "title": "묻힌 보고서",
            "function": "분기 실적 보고 회의에서 시혁이 2주 야근한 SCM 비용 절감 보고서가 사업부장 한마디에 묻힌다. 팀장은 '네 자료는 참고만 했다고 해'라고 말한다. 3년간의 공 증발이 한 장면에 압축된다."
          },
          {
            "block": 2,
            "title": "검진 결과지",
            "function": "건강검진 결과지에 '정밀검사 요망' 소견 하나. 다음 날 출근해서 같은 SCM 보고서를 다시 보는데 전혀 다른 것이 보인다. 사업부장이 왜 잘랐는지의 진짜 이유가 읽힌다. 팀장 결재선을 건너뛰어 전무에게 직접 올린다. 전무가 시혁의 이름을 처음 부른다. 첫 사이다. Lv1→Lv2 배석권 점프."
          },
          {
            "block": 3,
            "title": "전무실 배석",
            "function": "첫 전무 주재 회의 배석. 시혁은 발언하지 않고 회의 후 1장짜리 메모만 올린다. 전무가 배석을 연장한다. 오세진이 못박았지만 전무가 이를 무력화한다. 두 번째 사이다. CC 라인 비공식 진입."
          },
          {
            "block": 4,
            "title": "팀장의 견제",
            "function": "오세진이 시혁의 부상을 감지하고 견제를 시작한다. 시혁의 다음 보고서를 자기 이름으로 올리려 하고, 배석 기회를 차단하려 한다. 시혁의 첫 번째 벽."
          },
          {
            "block": 5,
            "title": "물류센터 통합안",
            "function": "전사 물류센터 통합 프로젝트가 임원회의 안건으로 올라온다. 외부 컨설팅 보고서 기반 3센터를 1센터로 합치는 안이자, 대표 승인 뒤 전사 비용절감 시그널 사업으로 올라갈 계획이다. 시혁이 배석 중 자료를 보자 숨겨진 치명 결함이 읽힌다."
          },
          {
            "block": 6,
            "title": "데이터 추적",
            "function": "시혁이 물류 실데이터를 추적한다. 컨설팅사가 MD사업부 제공 조작 재고 데이터를 그대로 썼다는 것을 확인. 실제 물동량 기준 통합 시 6개월 내 물류 마비 예측. 대안을 하룻밤 만에 설계."
          },
          {
            "block": 7,
            "title": "임원회의 아침",
            "function": "ARC-01 대표 스파이크. 회의 당일 아침 전무에게 대안을 올린다. 임원회의에서 기존 통합안이 보류되고 시혁의 대안이 검토 안건으로 채택된다. 말단 사원이 전사 최대 투자안을 멈춘 순간이며, 오프닝 간판 장면이다."
          },
          {
            "block": 8,
            "title": "보상 4종",
            "function": "대표이사가 전사 메일에 시혁 실명 언급. 물류 재설계 TF 실무 간사 발령. 경영기획팀 구석에서 전무실 옆 TF룸으로 자리 이동. 팀장 CC에서 빠지고 전무 직보 CC 진입. Lv2에서 Lv4 상신권 점프."
          },
          {
            "block": 9,
            "title": "TF 첫 회의",
            "function": "물류 재설계 TF 첫 회의에서 시혁이 부장급 인원들 사이에 앉는다. 실무 간사지만 데이터를 가장 잘 읽는 사람으로 자리매김. 새로운 전장의 규칙을 익히기 시작한다."
          },
          {
            "block": 10,
            "title": "장현태의 반격 준비",
            "function": "MD사업부장 장현태가 시혁 때문에 통합안이 멈춘 것을 인지한다. 숨긴 데이터를 지키기 위한 조직적 방어를 시작. 다음 아크의 적대축 본격 가동."
          }
        ]
      },
      {
        "arc_id": "ARC-02",
        "title": "TF룸의 말단",
        "block_range": "11-20",
        "time_window": "2025년 5월~2025년 7월",
        "capital_target": "Lv4 상신권 -> Lv5 예산 발언권",
        "front_sectors": [
          "물류 재설계 TF",
          "경영기획팀"
        ],
        "support_sectors": [
          "MD사업부",
          "SCM팀"
        ],
        "main_opponents": [
          "장현태",
          "오세진"
        ],
        "new_npcs": [
          "물류팀장 (TF 내 협력자 후보)",
          "MD실무진 (장현태의 방패)"
        ],
        "emotion_curve": "신전장 적응 -> 능력 확장(사람 읽기) -> 팀장 견제 돌파 -> 예산 발언권 획득",
        "quiet_blocks": [
          15
        ],
        "defeat_blocks": [
          13,
          18
        ],
        "entry_function": "TF 실무 간사로서 부장급과 대등하게 앉되, 실질 권한은 아직 자료 정리 수준. 감각이 숫자 읽기에서 사람 읽기로 확장되기 시작.",
        "exit_function": "분기 예산 편성 회의에서 시혁이 처음으로 숫자를 움직인다. Lv5 예산 발언권 획득. 동시에 장현태의 본격 반격이 시작.",
        "block_slots": [
          {
            "block": 11,
            "title": "TF룸 배치",
            "function": "시혁이 전무실 옆 TF룸에 정식 배치되지만, 명함은 그대로 사원이고 역할도 실무 간사에 그친다. 자리는 올라갔지만 발언권은 아직 자료 정리 수준이라는 현실을 확인한다."
          },
          {
            "block": 12,
            "title": "부장들 사이의 막내",
            "function": "첫 TF 회의에서 시혁은 숫자보다 사람의 반응이 먼저 읽히는 변화를 체감한다. 누가 장현태 편이고 누가 숫자만 보면 흔들릴 사람인지가 회의실 배치만으로 보이기 시작한다."
          },
          {
            "block": 13,
            "title": "자료 셔틀 함정",
            "function": "오세진은 시혁을 다시 자료 셔틀로 묶어 두려 하고, 장현태 쪽도 실무 질문을 폭탄처럼 던져 시혁을 회의 밖으로 밀어내려 한다. 시혁은 첫 TF 발언권을 잃고, 배석만 하는 사람으로 보일 위기에 처한다."
          },
          {
            "block": 14,
            "title": "우선순위 표",
            "function": "시혁은 물류 재설계 안건을 비용이 아니라 병목 순서로 다시 배열해 전무에게 올린다. 부장들이 흘려보낸 숫자가 우선순위 표 하나로 살아나며, 시혁이 단순 정리 담당이 아니라 판단을 붙일 수 있는 사람이라는 인상이 생긴다."
          },
          {
            "block": 15,
            "title": "회의실 밖 10분",
            "function": "시혁은 점심 뒤 복도와 흡연실, 탕비실에서 오가는 대화를 조용히 본다. 숫자보다 사람이 먼저 무너지는 지점을 읽으며, 감각이 보고서뿐 아니라 조직의 말줄임까지 잡는다는 걸 처음 자각한다."
          },
          {
            "block": 16,
            "title": "물류팀장의 편",
            "function": "TF 안에서 가장 까다롭던 물류팀장이 시혁이 잡아낸 병목 하나를 인정한다. 시혁은 처음으로 현장 쪽 협력자 한 명을 확보하고, 장현태 라인이 가리는 데이터 말고 현장 숫자를 직접 받기 시작한다."
          },
          {
            "block": 17,
            "title": "숨은 예산 줄",
            "function": "시혁은 물류 재설계 비용표 안에 장현태 쪽이 숨겨 둔 예산 이동 흔적을 본다. 예산 항목 하나가 바뀌면 TF의 우선순위와 책임 라인까지 바뀐다는 사실을 깨닫고, 다음 승부가 예산 회의에 있다는 걸 확신한다."
          },
          {
            "block": 18,
            "title": "잘린 안건",
            "function": "예산 사전 검토 회의에서 장현태는 시혁이 준비한 안건을 '실무 검토 부족'이라는 말로 잘라낸다. 시혁은 숫자가 맞아도 결재선 순서가 틀리면 아무것도 못 움직인다는 걸 뼈저리게 배운다."
          },
          {
            "block": 19,
            "title": "숫자 순서 바꾸기",
            "function": "시혁은 누가 어떤 숫자에 반응하는지 역으로 읽어 회의 순서 자체를 다시 짠다. 물류팀장과 전무 라인을 먼저 묶어 장현태가 방어할 시간을 줄이고, 오세진이 끼어들 틈도 막는다."
          },
          {
            "block": 20,
            "title": "분기 예산 회의",
            "function": "분기 예산 편성 회의에서 시혁이 처음으로 숫자를 말하고 그 숫자가 실제 반영된다. 말단 사원이 아니라 예산 줄 하나를 움직이는 사람으로 올라서며, Lv5 예산 발언권을 확보한다."
          }
        ]
      },
      {
        "arc_id": "ARC-03",
        "title": "숨겨진 숫자",
        "block_range": "21-30",
        "time_window": "2025년 7월~2025년 9월",
        "capital_target": "Lv5 예산 발언권 유지 + 프로젝트 오너십 첫 획득",
        "front_sectors": [
          "MD사업부 감사",
          "물류 재설계"
        ],
        "support_sectors": [
          "재무팀",
          "외부 감사"
        ],
        "main_opponents": [
          "장현태",
          "MD실무진"
        ],
        "new_npcs": [
          "재무팀 차장 (숫자 검증 협력자)",
          "외부 감사인"
        ],
        "emotion_curve": "적의 숫자를 파기 시작 -> 장현태 조직적 방어 -> 첫 정면 충돌 -> 부분 승리",
        "quiet_blocks": [
          25
        ],
        "defeat_blocks": [
          23,
          28
        ],
        "entry_function": "시혁이 TF 데이터 속에서 MD사업부의 재고/반품 은폐 패턴을 잡기 시작한다.",
        "exit_function": "MD사업부의 숨겨진 적자 일부가 드러나 사업부 자체 감사가 발동된다. 시혁이 감사 지원 TF를 추가로 맡는다.",
        "block_slots": [
          {
            "block": 21,
            "title": "반품창고의 냄새",
            "function": "시혁은 TF 데이터를 정리하다가 반품창고 수치와 MD사업부 재고 보고가 미세하게 어긋난다는 걸 포착한다. 숫자 하나가 아니라 구조 전체가 틀어져 있다는 첫 냄새를 맡는다."
          },
          {
            "block": 22,
            "title": "재무팀 차장",
            "function": "시혁은 재무팀 차장에게 접근해 숫자 검증용 우회 라인을 확보한다. 장현태 라인이 막아도 재무 숫자로 다시 확인할 수 있는 협력자를 얻으며 감사의 발판을 놓는다."
          },
          {
            "block": 23,
            "title": "감사 범위 컷",
            "function": "장현태는 감사 범위를 물류 재설계 주변부로만 좁히려 하고, 시혁이 보려던 반품·재고 라인을 공식 테이블에서 잘라낸다. 시혁은 준비한 칼을 뽑지도 못한 채 한 차례 밀린다."
          },
          {
            "block": 24,
            "title": "누락된 한 줄",
            "function": "시혁은 장표보다 전표 하단 메모 한 줄에서 재고 이동의 진짜 방향을 읽는다. 누락처럼 보이던 흔적이 은폐 패턴의 시작점이라는 걸 확인하면서, 감사 범위를 다시 넓힐 실마리를 잡는다."
          },
          {